	category1	category2	ko_id	function	species_name	hsds_id	hsds_num
1644	09141 Transport and catabolism	04144 Endocytosis [PATH:ko04144]	K19475  WIPF; WAS/WASL-interacting protein		Chlamydomonas_reinhardtii.80_70	XP_042922048.1	1
1645	09141 Transport and catabolism	04145 Phagosome [PATH:ko04145]	K07374  TUBA; tubulin alpha		Chlamydomonas_reinhardtii.80_70	XP_001691876.1	1
1646	09141 Transport and catabolism	04145 Phagosome [PATH:ko04145]	K07375  TUBB; tubulin beta		Chlamydomonas_reinhardtii.80_70	XP_001693997.1	1
1647	09143 Cell growth and death	04217 Necroptosis [PATH:ko04217]	K11251  H2A; histone H2A		Chlamydomonas_reinhardtii.80_70	XP_001690672.1	1
1648	09151 Immune system	04621 NOD-like receptor signaling pathway [PATH:ko04621]	K14216  OAS; 2'-5'-oligoadenylate synthetase 		Chlamydomonas_reinhardtii.80_70	XP_042917837.1	1
1649	09152 Endocrine system	04614 Renin-angiotensin system [PATH:ko04614]	K01322  PREP; prolyl oligopeptidase 		Chlamydomonas_reinhardtii.80_70	XP_042919183.1	1
1650	09154 Digestive system	04970 Salivary secretion [PATH:ko04970]	K13912  MBT1; deleted in malignant brain tumors 1 protein		Chlamydomonas_reinhardtii.80_70	XP_042922323.1	1
1651	09158 Development and regeneration	04361 Axon regeneration [PATH:ko04361]	K11593  ELF2C, AGO; eukaryotic translation initiation factor 2C		Chlamydomonas_reinhardtii.80_70	XP_042916315.1	1
1652	09159 Environmental adaptation	04714 Thermogenesis [PATH:ko04714]	K15109  SLC25A20_29, CACT, CACL, CRC1; solute carrier family 25 (mitochondrial carnitine/acylcarnitine transporter), member 20/29		Chlamydomonas_reinhardtii.80_70	XP_001692197.1	1
1653	09161 Cancer: overview	05202 Transcriptional misregulation in cancer [PATH:ko05202]	K11253  H3; histone H3		Chlamydomonas_reinhardtii.80_70	XP_001690671.1	1
1654	09161 Cancer: overview	05203 Viral carcinogenesis [PATH:ko05203]	K11252  H2B; histone H2B		Chlamydomonas_reinhardtii.80_70	XP_001690668.1	1
1655	09161 Cancer: overview	05203 Viral carcinogenesis [PATH:ko05203]	K11254  H4; histone H4		Chlamydomonas_reinhardtii.80_70	XP_001690721.1	1
1656	09163 Immune disease	05322 Systemic lupus erythematosus [PATH:ko05322]	K11089  TROVE2, SSA2; 60 ka SS-A/Ro ribonucleoprotein		Chlamydomonas_reinhardtii.80_70	XP_042920310.1	1
1657	09171 Infectious disease: bacterial	05132 Salmonella infection [PATH:ko05132]	K10419  YNLRB, NCL2; dynein light chain roadblock-type		Chlamydomonas_reinhardtii.80_70	XP_001694381.1	1
1658	09181 Protein families: metabolism	01001 Protein kinases [BR:ko01001]	K12132  prkC, stkP; eukaryotic-like serine/threonine-protein kinase 		Chlamydomonas_reinhardtii.80_70	XP_001690935.1, XP_042923935.1	2
1659	09181 Protein families: metabolism	01009 Protein phosphatases and associated proteins [BR:ko01009]	K15504  ANKR52; serine/threonine-protein phosphatase 6 regulatory ankyrin repeat subunit C		Chlamydomonas_reinhardtii.80_70	XP_042920752.1	1
1660	09181 Protein families: metabolism	01002 Peptidases and inhibitors [BR:ko01002]	K09602  OTUB1; ubiquitin thioesterase protein OTUB1 		Chlamydomonas_reinhardtii.80_70	XP_042923344.1	1
1661	09182 Protein families: genetic information processing	03000 Transcription factors [BR:ko03000]	K09387  FOXA1, HNF3A; forkhead box protein A1, hepatocyte nuclear factor 3-alpha		Chlamydomonas_reinhardtii.80_70	XP_042914114.1	1
1662	09182 Protein families: genetic information processing	03000 Transcription factors [BR:ko03000]	K09284  AP2; AP2-like factor, euAP2 lineage		Chlamydomonas_reinhardtii.80_70	XP_001700294.2	1
1663	09182 Protein families: genetic information processing	03000 Transcription factors [BR:ko03000]	K09286  EREBP; EREBP-like factor		Chlamydomonas_reinhardtii.80_70	XP_042921884.1	1
1664	09182 Protein families: genetic information processing	03041 Spliceosome [BR:ko03041]	K13103  TFIP11; tuftelin-interacting protein 11		Chlamydomonas_reinhardtii.80_70	XP_042922841.1	1
1665	09182 Protein families: genetic information processing	03009 Ribosome biogenesis [BR:ko03009]	K11135  PINX1; Pin2-interacting protein X1		Chlamydomonas_reinhardtii.80_70	XP_042923055.1	1
1666	09182 Protein families: genetic information processing	03009 Ribosome biogenesis [BR:ko03009]	K14810  X56, BP9; ATP-dependent RNA helicase X56/BP9 		Chlamydomonas_reinhardtii.80_70	XP_042918562.1	1
1667	09182 Protein families: genetic information processing	03012 Translation factors [BR:ko03012]	K22857  EEF1AKMT4; EEF1A lysine methyltransferase 4 		Chlamydomonas_reinhardtii.80_70	XP_042925030.1	1
1668	09182 Protein families: genetic information processing	03110 haperones and folding catalysts [BR:ko03110]	K04082  hscB, HSCB, HSC20; molecular chaperone HscB		Chlamydomonas_reinhardtii.80_70	XP_042918185.1	1
1669	09182 Protein families: genetic information processing	03110 haperones and folding catalysts [BR:ko03110]	K03768  PPIB, ppiB; peptidyl-prolyl cis-trans isomerase B (cyclophilin B) 		Chlamydomonas_reinhardtii.80_70	XP_042919139.1, XP_001693941.2	2
1670	09182 Protein families: genetic information processing	04131 Membrane trafficking [BR:ko04131]	K21440  ANKR50; ankyrin repeat domain-containing protein 50		Chlamydomonas_reinhardtii.80_70	XP_042920519.1	1
1671	09182 Protein families: genetic information processing	04131 Membrane trafficking [BR:ko04131]	K01551  arsA, ASNA1, GET3; arsenite/tail-anchored protein-transporting ATPase 		Chlamydomonas_reinhardtii.80_70	XP_042914113.1	1
1672	09182 Protein families: genetic information processing	04121 Ubiquitin system [BR:ko04121]	K12158  NE8; ubiquitin-like protein Nedd8		Chlamydomonas_reinhardtii.80_70	XP_001694608.1	1
1673	09182 Protein families: genetic information processing	04121 Ubiquitin system [BR:ko04121]	K10645  MIB; E3 ubiquitin-protein ligase mind-bomb 		Chlamydomonas_reinhardtii.80_70	XP_042914452.1, XP_042914455.1	2
1674	09182 Protein families: genetic information processing	04121 Ubiquitin system [BR:ko04121]	K10466  KLHL30; kelch-like protein 30		Chlamydomonas_reinhardtii.80_70	XP_042916643.1	1
1675	09182 Protein families: genetic information processing	04121 Ubiquitin system [BR:ko04121]	K10474  KBTB6_7; kelch repeat and BTB domain-containing protein 6/7		Chlamydomonas_reinhardtii.80_70	XP_042914366.1	1
1676	09182 Protein families: genetic information processing	03036 hromosome and associated proteins [BR:ko03036]	K11657  RSF1; remodeling and spacing factor 1		Chlamydomonas_reinhardtii.80_70	XP_042916043.1	1
1677	09182 Protein families: genetic information processing	03400 DNA repair and recombination proteins [BR:ko03400]	K19596  PLK5; inactive serine/threonine-protein kinase PLK5		Chlamydomonas_reinhardtii.80_70	XP_042925027.1	1
1678	09182 Protein families: genetic information processing	03400 DNA repair and recombination proteins [BR:ko03400]	K03574  mutT, NUT15, MTH2; 8-oxo-dGTP diphosphatase 		Chlamydomonas_reinhardtii.80_70	XP_001691864.2	1
1679	09183 Protein families: signaling and cellular processes	02000 Transporters [BR:ko02000]	K14724  SLC9A8, NHE8; solute carrier family 9 (sodium/hydrogen exchanger), member 8		Chlamydomonas_reinhardtii.80_70	XP_042915861.1	1
1680	09183 Protein families: signaling and cellular processes	02000 Transporters [BR:ko02000]	K14347  SLC10A7, P7; solute carrier family 10 (sodium/bile acid cotransporter), member 7		Chlamydomonas_reinhardtii.80_70	XP_042927186.1	1
1681	09183 Protein families: signaling and cellular processes	02000 Transporters [BR:ko02000]	K14640  SLC20A, PIT; solute carrier family 20 (sodium-dependent phosphate transporter)		Chlamydomonas_reinhardtii.80_70	XP_001702863.1, XP_001694872.1, XP_001694873.1	3
1682	09183 Protein families: signaling and cellular processes	02000 Transporters [BR:ko02000]	K08994  yneE, BEST; ion channel-forming bestrophin family protein		Chlamydomonas_reinhardtii.80_70	XP_001697952.2	1
1683	09183 Protein families: signaling and cellular processes	02000 Transporters [BR:ko02000]	K20989  UR3; urea-proton symporter		Chlamydomonas_reinhardtii.80_70	XP_001702308.2	1
1684	09183 Protein families: signaling and cellular processes	02000 Transporters [BR:ko02000]	K23887  UAPA_C; uric acid-xanthine permease		Chlamydomonas_reinhardtii.80_70	XP_001690514.1	1
1685	09183 Protein families: signaling and cellular processes	02000 Transporters [BR:ko02000]	K03322  mntH; manganese transport protein		Chlamydomonas_reinhardtii.80_70	XP_001691702.1	1
1686	09183 Protein families: signaling and cellular processes	02000 Transporters [BR:ko02000]	K03549  kup; KUP system potassium uptake protein		Chlamydomonas_reinhardtii.80_70	XP_042914589.1	1
1687	09183 Protein families: signaling and cellular processes	02000 Transporters [BR:ko02000]	K22736  VIT; vacuolar iron transporter family protein		Chlamydomonas_reinhardtii.80_70	XP_001700022.2	1
1688	09191 Unclassified: metabolism	99999 Others	K22390  ACP7; acid phosphatase type 7		Chlamydomonas_reinhardtii.80_70	XP_042917479.1	1
1689	09192 Unclassified: genetic information processing	99976 Replication and repair	K07496  K07496; putative transposase		Chlamydomonas_reinhardtii.80_70	XP_001698006.1	1
1690	09194 Poorly characterized	99997 Function unknown	K07034  K07034; uncharacterized protein		Chlamydomonas_reinhardtii.80_70	XP_001691586.2	1
1691	09101 Carbohydrate metabolism	00010 Glycolysis / Gluconeogenesis [PATH:ko00010]	K00121  frmA, AH5, adhC; S-(hydroxymethyl)glutathione dehydrogenase / alcohol dehydrogenase 		Chlamydomonas_reinhardtii.90_50	XP_042919155.1	1
1692	09101 Carbohydrate metabolism	00040 Pentose and glucuronate interconversions [PATH:ko00040]	K00012  UGH, ugd; UPglucose 6-dehydrogenase 		Chlamydomonas_reinhardtii.90_50	XP_001698004.1	1
1693	09101 Carbohydrate metabolism	00630 Glyoxylate and dicarboxylate metabolism [PATH:ko00630]	K01602  rbcS, cbbS; ribulose-bisphosphate carboxylase small chain 		Chlamydomonas_reinhardtii.90_50	XP_001702409.1	1
1694	09101 Carbohydrate metabolism	00630 Glyoxylate and dicarboxylate metabolism [PATH:ko00630]	K01915  glnA, GLUL; glutamine synthetase 		Chlamydomonas_reinhardtii.90_50	XP_001692927.2	1
1695	09102 Energy metabolism	00195 Photosynthesis [PATH:ko00195]	K03542  psbS; photosystem II 22ka protein		Chlamydomonas_reinhardtii.90_50	XP_001689476.1	1
1696	09102 Energy metabolism	00196 Photosynthesis - antenna proteins [PATH:ko00196]	K08912  LHCB1; light-harvesting complex II chlorophyll a/b binding protein 1		Chlamydomonas_reinhardtii.90_50	XP_001695344.1	1
1697	09102 Energy metabolism	00196 Photosynthesis - antenna proteins [PATH:ko00196]	K08913  LHCB2; light-harvesting complex II chlorophyll a/b binding protein 2		Chlamydomonas_reinhardtii.90_50	XP_001695344.1, XP_001693987.1	2
1698	09102 Energy metabolism	00680 Methane metabolism [PATH:ko00680]	K01079  serB, PSPH; phosphoserine phosphatase 		Chlamydomonas_reinhardtii.90_50	XP_042925046.1	1
1699	09102 Energy metabolism	00910 Nitrogen metabolism [PATH:ko00910]	K05601  hcp; hydroxylamine reductase 		Chlamydomonas_reinhardtii.90_50	XP_001694671.1, XP_001694454.1	2
1700	09102 Energy metabolism	00910 Nitrogen metabolism [PATH:ko00910]	K01673  cynT, can; carbonic anhydrase 		Chlamydomonas_reinhardtii.90_50	XP_042924593.1	1
1701	09102 Energy metabolism	00910 Nitrogen metabolism [PATH:ko00910]	K01674  cah; carbonic anhydrase 		Chlamydomonas_reinhardtii.90_50	XP_001692290.1	1
1702	09103 Lipid metabolism	00564 Glycerophospholipid metabolism [PATH:ko00564]	K00006  GP1; glycerol-3-phosphate dehydrogenase (NA+) 		Chlamydomonas_reinhardtii.90_50	XP_042928911.1	1
1703	09105 Amino acid metabolism	00250 Alanine, aspartate and glutamate metabolism [PATH:ko00250]	K13566  NIT2, yafV; omega-amidase 		Chlamydomonas_reinhardtii.90_50	XP_001690839.2	1
1704	09105 Amino acid metabolism	00260 Glycine, serine and threonine metabolism [PATH:ko00260]	K00872  thrB; homoserine kinase 		Chlamydomonas_reinhardtii.90_50	XP_042926889.1	1
1705	09105 Amino acid metabolism	00270 ysteine and methionine metabolism [PATH:ko00270]	K05396  dcy; -cysteine desulfhydrase 		Chlamydomonas_reinhardtii.90_50	XP_042922514.1	1
1706	09105 Amino acid metabolism	00270 ysteine and methionine metabolism [PATH:ko00270]	K08968  msrC; L-methionine (R)-S-oxide reductase 		Chlamydomonas_reinhardtii.90_50	XP_042923055.1	1
1707	09105 Amino acid metabolism	00350 Tyrosine metabolism [PATH:ko00350]	K00457  HP, hpp; 4-hydroxyphenylpyruvate dioxygenase 		Chlamydomonas_reinhardtii.90_50	XP_001694722.2	1
1708	09107 Glycan biosynthesis and metabolism	00534 Glycosaminoglycan biosynthesis - heparan sulfate / heparin [PATH:ko00534]	K01793  GLCE; heparosan-N-sulfate-glucuronate 5-epimerase 		Chlamydomonas_reinhardtii.90_50	XP_042918104.1	1
1709	09108 Metabolism of cofactors and vitamins	00860 Porphyrin and chlorophyll metabolism [PATH:ko00860]	K01764  HCCS; cytochrome c heme-lyase 		Chlamydomonas_reinhardtii.90_50	XP_042918551.1, XP_042918573.1, XP_042918560.1	3
1710	09108 Metabolism of cofactors and vitamins	00130 Ubiquinone and other terpenoid-quinone biosynthesis [PATH:ko00130]	K03809  wrbA; NA(P)H dehydrogenase (quinone) 		Chlamydomonas_reinhardtii.90_50	XP_001698551.1	1
1711	09109 Metabolism of terpenoids and polyketides	00906 arotenoid biosynthesis [PATH:ko00906]	K17913  CC8; carlactone synthase / all-trans-10'-apo-beta-carotenal 13,14-cleaving dioxygenase 		Chlamydomonas_reinhardtii.90_50	XP_001701620.1	1
1712	09121 Transcription	03040 Spliceosome [PATH:ko03040]	K12818  HX8, PRP22; ATP-dependent RNA helicase HX8/PRP22 		Chlamydomonas_reinhardtii.90_50	XP_042922719.1	1
1713	09121 Transcription	03040 Spliceosome [PATH:ko03040]	K03283  HSPA1s; heat shock 70ka protein 1/2/6/8		Chlamydomonas_reinhardtii.90_50	XP_001691146.2	1
1714	09122 Translation	03010 Ribosome [PATH:ko03010]	K02927  RP-L40e, RPL40, UBA52; ubiquitin-large subunit ribosomal protein L40e		Chlamydomonas_reinhardtii.90_50	XP_001694608.1	1
1715	09122 Translation	00970 Aminoacyl-tRNA biosynthesis [PATH:ko00970]	K01870  IARS, ileS; isoleucyl-tRNA synthetase 		Chlamydomonas_reinhardtii.90_50	XP_001698234.1	1
1716	09122 Translation	03013 RNA transport [PATH:ko03013]	K03231  EEF1A; elongation factor 1-alpha		Chlamydomonas_reinhardtii.90_50	XP_001696568.1	1
1717	09122 Translation	03013 RNA transport [PATH:ko03013]	K12160  SUMO, SMT3; small ubiquitin-related modifier		Chlamydomonas_reinhardtii.90_50	XP_042914618.1	1
1718	09122 Translation	03008 Ribosome biogenesis in eukaryotes [PATH:ko03008]	K11129  NHP2, NOLA2; H/ACA ribonucleoprotein complex subunit 2		Chlamydomonas_reinhardtii.90_50	XP_001699242.1	1
1719	09123 Folding, sorting and degradation	03060 Protein export [PATH:ko03060]	K09490  HSPA5, BIP; endoplasmic reticulum chaperone BiP 		Chlamydomonas_reinhardtii.90_50	XP_001701884.2	1
1720	09123 Folding, sorting and degradation	04141 Protein processing in endoplasmic reticulum [PATH:ko04141]	K13993  HSP20; HSP20 family protein		Chlamydomonas_reinhardtii.90_50	XP_001689821.1	1
1721	09124 Replication and repair	03030 DNA replication [PATH:ko03030]	K04799  FEN1, RA2; flap endonuclease-1 		Chlamydomonas_reinhardtii.90_50	XP_001699242.1	1
1722	09132 Signal transduction	04015 Rap1 signaling pathway [PATH:ko04015]	K23487  EVL; Ena/VASP-like protein		Chlamydomonas_reinhardtii.90_50	XP_042916474.1	1
1723	09132 Signal transduction	04013 MAPK signaling pathway - fly [PATH:ko04013]	K08892  FRK, PTK5; fyn-related kinase 		Chlamydomonas_reinhardtii.90_50	XP_001694443.2	1
1724	09132 Signal transduction	04310 Wnt signaling pathway [PATH:ko04310]	K17334  NFATC4, NFAT3; nuclear factor of activated T-cells, cytoplasmic 4		Chlamydomonas_reinhardtii.90_50	XP_001692736.2	1
1725	09132 Signal transduction	04371 Apelin signaling pathway [PATH:ko04371]	K18050  PRKCE; novel protein kinase C epsilon type 		Chlamydomonas_reinhardtii.90_50	XP_042926332.1	1
1726	09132 Signal transduction	04072 Phospholipase D signaling pathway [PATH:ko04072]	K07937  ARF1_2; AP-ribosylation factor 1/2		Chlamydomonas_reinhardtii.90_50	XP_001690893.1	1
1727	09141 Transport and catabolism	04145 Phagosome [PATH:ko04145]	K07374  TUBA; tubulin alpha		Chlamydomonas_reinhardtii.90_50	XP_001691876.1	1
1728	09141 Transport and catabolism	04145 Phagosome [PATH:ko04145]	K07375  TUBB; tubulin beta		Chlamydomonas_reinhardtii.90_50	XP_001693997.1	1
1729	09143 Cell growth and death	04217 Necroptosis [PATH:ko04217]	K11251  H2A; histone H2A		Chlamydomonas_reinhardtii.90_50	XP_001690672.1	1
1730	09151 Immune system	04621 NOD-like receptor signaling pathway [PATH:ko04621]	K14216  OAS; 2'-5'-oligoadenylate synthetase 		Chlamydomonas_reinhardtii.90_50	XP_042917837.1	1
1731	09159 Environmental adaptation	04714 Thermogenesis [PATH:ko04714]	K15109  SLC25A20_29, CACT, CACL, CRC1; solute carrier family 25 (mitochondrial carnitine/acylcarnitine transporter), member 20/29		Chlamydomonas_reinhardtii.90_50	XP_001692197.1	1
1732	09161 Cancer: overview	05202 Transcriptional misregulation in cancer [PATH:ko05202]	K11253  H3; histone H3		Chlamydomonas_reinhardtii.90_50	XP_001690671.1	1
1733	09161 Cancer: overview	05203 Viral carcinogenesis [PATH:ko05203]	K11252  H2B; histone H2B		Chlamydomonas_reinhardtii.90_50	XP_001690668.1	1
1734	09161 Cancer: overview	05203 Viral carcinogenesis [PATH:ko05203]	K11254  H4; histone H4		Chlamydomonas_reinhardtii.90_50	XP_001690721.1	1
1735	09163 Immune disease	05322 Systemic lupus erythematosus [PATH:ko05322]	K11089  TROVE2, SSA2; 60 ka SS-A/Ro ribonucleoprotein		Chlamydomonas_reinhardtii.90_50	XP_042920310.1	1
1736	09171 Infectious disease: bacterial	05132 Salmonella infection [PATH:ko05132]	K10419  YNLRB, NCL2; dynein light chain roadblock-type		Chlamydomonas_reinhardtii.90_50	XP_001694381.1	1
1737	09181 Protein families: metabolism	01002 Peptidases and inhibitors [BR:ko01002]	K09602  OTUB1; ubiquitin thioesterase protein OTUB1 		Chlamydomonas_reinhardtii.90_50	XP_042923344.1	1
1738	09182 Protein families: genetic information processing	03000 Transcription factors [BR:ko03000]	K09387  FOXA1, HNF3A; forkhead box protein A1, hepatocyte nuclear factor 3-alpha		Chlamydomonas_reinhardtii.90_50	XP_042919355.1, XP_042923050.1, XP_042920704.1	3
1739	09182 Protein families: genetic information processing	03009 Ribosome biogenesis [BR:ko03009]	K11135  PINX1; Pin2-interacting protein X1		Chlamydomonas_reinhardtii.90_50	XP_042923055.1	1
1740	09182 Protein families: genetic information processing	03012 Translation factors [BR:ko03012]	K22857  EEF1AKMT4; EEF1A lysine methyltransferase 4 		Chlamydomonas_reinhardtii.90_50	XP_042925033.1	1
1741	09182 Protein families: genetic information processing	03110 haperones and folding catalysts [BR:ko03110]	K04082  hscB, HSCB, HSC20; molecular chaperone HscB		Chlamydomonas_reinhardtii.90_50	XP_042918185.1	1
1742	09182 Protein families: genetic information processing	03110 haperones and folding catalysts [BR:ko03110]	K03768  PPIB, ppiB; peptidyl-prolyl cis-trans isomerase B (cyclophilin B) 		Chlamydomonas_reinhardtii.90_50	XP_042919139.1, XP_001693941.2	2
1743	09182 Protein families: genetic information processing	04131 Membrane trafficking [BR:ko04131]	K21440  ANKR50; ankyrin repeat domain-containing protein 50		Chlamydomonas_reinhardtii.90_50	XP_042920519.1	1
1744	09182 Protein families: genetic information processing	04131 Membrane trafficking [BR:ko04131]	K01551  arsA, ASNA1, GET3; arsenite/tail-anchored protein-transporting ATPase 		Chlamydomonas_reinhardtii.90_50	XP_042914113.1	1
1745	09182 Protein families: genetic information processing	04121 Ubiquitin system [BR:ko04121]	K12158  NE8; ubiquitin-like protein Nedd8		Chlamydomonas_reinhardtii.90_50	XP_001694608.1	1
1746	09182 Protein families: genetic information processing	04121 Ubiquitin system [BR:ko04121]	K10645  MIB; E3 ubiquitin-protein ligase mind-bomb 		Chlamydomonas_reinhardtii.90_50	XP_042914454.1	1
1747	09182 Protein families: genetic information processing	03036 hromosome and associated proteins [BR:ko03036]	K11657  RSF1; remodeling and spacing factor 1		Chlamydomonas_reinhardtii.90_50	XP_042916043.1	1
1748	09182 Protein families: genetic information processing	03400 DNA repair and recombination proteins [BR:ko03400]	K19596  PLK5; inactive serine/threonine-protein kinase PLK5		Chlamydomonas_reinhardtii.90_50	XP_042925014.1	1
1749	09183 Protein families: signaling and cellular processes	02000 Transporters [BR:ko02000]	K14347  SLC10A7, P7; solute carrier family 10 (sodium/bile acid cotransporter), member 7		Chlamydomonas_reinhardtii.90_50	XP_042927186.1	1
1750	09183 Protein families: signaling and cellular processes	02000 Transporters [BR:ko02000]	K14640  SLC20A, PIT; solute carrier family 20 (sodium-dependent phosphate transporter)		Chlamydomonas_reinhardtii.90_50	XP_001702863.1, XP_001694872.1, XP_001694873.1	3
1751	09183 Protein families: signaling and cellular processes	02000 Transporters [BR:ko02000]	K23887  UAPA_C; uric acid-xanthine permease		Chlamydomonas_reinhardtii.90_50	XP_001702481.2	1
1752	09183 Protein families: signaling and cellular processes	02000 Transporters [BR:ko02000]	K03549  kup; KUP system potassium uptake protein		Chlamydomonas_reinhardtii.90_50	XP_042914589.1	1
1753	09194 Poorly characterized	99997 Function unknown	K07034  K07034; uncharacterized protein		Chlamydomonas_reinhardtii.90_50	XP_001691586.2	1
1754	09101 Carbohydrate metabolism	00010 Glycolysis / Gluconeogenesis [PATH:ko00010]	K00121  frmA, AH5, adhC; S-(hydroxymethyl)glutathione dehydrogenase / alcohol dehydrogenase 		Chlamydomonas_reinhardtii.70_10	XP_042919155.1	1
1755	09101 Carbohydrate metabolism	00040 Pentose and glucuronate interconversions [PATH:ko00040]	K00012  UGH, ugd; UPglucose 6-dehydrogenase 		Chlamydomonas_reinhardtii.70_10	XP_001698004.1	1
1756	09101 Carbohydrate metabolism	00500 Starch and sucrose metabolism [PATH:ko00500]	K00700  GBE1, glgB; 1,4-alpha-glucan branching enzyme 		Chlamydomonas_reinhardtii.70_10	XP_001690322.2	1
1757	09101 Carbohydrate metabolism	00630 Glyoxylate and dicarboxylate metabolism [PATH:ko00630]	K01602  rbcS, cbbS; ribulose-bisphosphate carboxylase small chain 		Chlamydomonas_reinhardtii.70_10	XP_001702409.1	1
1758	09101 Carbohydrate metabolism	00630 Glyoxylate and dicarboxylate metabolism [PATH:ko00630]	K01915  glnA, GLUL; glutamine synthetase 		Chlamydomonas_reinhardtii.70_10	XP_001692927.2	1
1759	09102 Energy metabolism	00190 Oxidative phosphorylation [PATH:ko00190]	K02128  ATPeF0C, ATP5G, ATP9; F-type H+-transporting ATPase subunit c		Chlamydomonas_reinhardtii.70_10	XP_001701500.1	1
1760	09102 Energy metabolism	00195 Photosynthesis [PATH:ko00195]	K03542  psbS; photosystem II 22ka protein		Chlamydomonas_reinhardtii.70_10	XP_001689476.1	1
1761	09102 Energy metabolism	00196 Photosynthesis - antenna proteins [PATH:ko00196]	K08912  LHCB1; light-harvesting complex II chlorophyll a/b binding protein 1		Chlamydomonas_reinhardtii.70_10	XP_001693987.1	1
1762	09102 Energy metabolism	00196 Photosynthesis - antenna proteins [PATH:ko00196]	K08913  LHCB2; light-harvesting complex II chlorophyll a/b binding protein 2		Chlamydomonas_reinhardtii.70_10	XP_001693987.1	1
1763	09102 Energy metabolism	00680 Methane metabolism [PATH:ko00680]	K00058  serA, PHGH; -3-phosphoglycerate dehydrogenase / 2-oxoglutarate reductase 		Chlamydomonas_reinhardtii.70_10	XP_001692429.2	1
1764	09102 Energy metabolism	00910 Nitrogen metabolism [PATH:ko00910]	K05601  hcp; hydroxylamine reductase 		Chlamydomonas_reinhardtii.70_10	XP_001694454.1	1
1765	09102 Energy metabolism	00910 Nitrogen metabolism [PATH:ko00910]	K01673  cynT, can; carbonic anhydrase 		Chlamydomonas_reinhardtii.70_10	XP_042924593.1	1
1766	09102 Energy metabolism	00910 Nitrogen metabolism [PATH:ko00910]	K01674  cah; carbonic anhydrase 		Chlamydomonas_reinhardtii.70_10	XP_001692290.1	1
1767	09103 Lipid metabolism	00564 Glycerophospholipid metabolism [PATH:ko00564]	K01126  E3.1.4.46, glpQ, ugpQ; glycerophosphoryl diester phosphodiesterase 		Chlamydomonas_reinhardtii.70_10	XP_042915965.1	1
1768	09104 Nucleotide metabolism	00230 Purine metabolism [PATH:ko00230]	K13755  PE1; calcium/calmodulin-dependent 3',5'-cyclic nucleotide phosphodiesterase 		Chlamydomonas_reinhardtii.70_10	XP_042918855.1, XP_042927481.1	2
1769	09104 Nucleotide metabolism	00230 Purine metabolism [PATH:ko00230]	K13293  PE4; cAMP-specific phosphodiesterase 4 		Chlamydomonas_reinhardtii.70_10	XP_042918881.1	1
1770	09105 Amino acid metabolism	00250 Alanine, aspartate and glutamate metabolism [PATH:ko00250]	K13566  NIT2, yafV; omega-amidase 		Chlamydomonas_reinhardtii.70_10	XP_001690839.2	1
1771	09105 Amino acid metabolism	00330 Arginine and proline metabolism [PATH:ko00330]	K00472  P4HA; prolyl 4-hydroxylase 		Chlamydomonas_reinhardtii.70_10	XP_001701720.2	1
1772	09105 Amino acid metabolism	00350 Tyrosine metabolism [PATH:ko00350]	K00457  HP, hpp; 4-hydroxyphenylpyruvate dioxygenase 		Chlamydomonas_reinhardtii.70_10	XP_001694722.2	1
1773	09106 Metabolism of other amino acids	00480 Glutathione metabolism [PATH:ko00480]	K00799  GST, gst; glutathione S-transferase 		Chlamydomonas_reinhardtii.70_10	XP_042916411.1	1
1774	09107 Glycan biosynthesis and metabolism	00534 Glycosaminoglycan biosynthesis - heparan sulfate / heparin [PATH:ko00534]	K01793  GLCE; heparosan-N-sulfate-glucuronate 5-epimerase 		Chlamydomonas_reinhardtii.70_10	XP_042918104.1	1
1775	09108 Metabolism of cofactors and vitamins	00860 Porphyrin and chlorophyll metabolism [PATH:ko00860]	K04035  E1.14.13.81, acsF, chlE; magnesium-protoporphyrin IX monomethyl ester (oxidative) cyclase 		Chlamydomonas_reinhardtii.70_10	XP_001691047.2	1
1776	09108 Metabolism of cofactors and vitamins	00860 Porphyrin and chlorophyll metabolism [PATH:ko00860]	K01764  HCCS; cytochrome c heme-lyase 		Chlamydomonas_reinhardtii.70_10	XP_042918565.1	1
1777	09108 Metabolism of cofactors and vitamins	00130 Ubiquinone and other terpenoid-quinone biosynthesis [PATH:ko00130]	K03809  wrbA; NA(P)H dehydrogenase (quinone) 		Chlamydomonas_reinhardtii.70_10	XP_001698551.1	1
1778	09121 Transcription	03040 Spliceosome [PATH:ko03040]	K12818  HX8, PRP22; ATP-dependent RNA helicase HX8/PRP22 		Chlamydomonas_reinhardtii.70_10	XP_042922719.1	1
