	category1	category2	ko_id	function	species_name	hsds_id	hsds_num
825	09102 Energy metabolism	00196 Photosynthesis - antenna proteins [PATH:ko00196]	K08913  LHCB2; light-harvesting complex II chlorophyll a/b binding protein 2		Chlamydomonas_reinhardtii.60_50	XP_001693987.1	1
826	09102 Energy metabolism	00680 Methane metabolism [PATH:ko00680]	K00058  serA, PHGH; -3-phosphoglycerate dehydrogenase / 2-oxoglutarate reductase 		Chlamydomonas_reinhardtii.60_50	XP_001692429.2	1
827	09102 Energy metabolism	00680 Methane metabolism [PATH:ko00680]	K01079  serB, PSPH; phosphoserine phosphatase 		Chlamydomonas_reinhardtii.60_50	XP_042925046.1	1
828	09102 Energy metabolism	00910 Nitrogen metabolism [PATH:ko00910]	K02575  NRT, narK, nrtP, nasA; MFS transporter, NNP family, nitrate/nitrite transporter		Chlamydomonas_reinhardtii.60_50	XP_001696788.2	1
829	09102 Energy metabolism	00910 Nitrogen metabolism [PATH:ko00910]	K05601  hcp; hydroxylamine reductase 		Chlamydomonas_reinhardtii.60_50	XP_001694454.1	1
830	09102 Energy metabolism	00910 Nitrogen metabolism [PATH:ko00910]	K01673  cynT, can; carbonic anhydrase 		Chlamydomonas_reinhardtii.60_50	XP_042924593.1	1
831	09102 Energy metabolism	00910 Nitrogen metabolism [PATH:ko00910]	K01674  cah; carbonic anhydrase 		Chlamydomonas_reinhardtii.60_50	XP_001692290.1	1
832	09102 Energy metabolism	00920 Sulfur metabolism [PATH:ko00920]	K00958  sat, met3; sulfate adenylyltransferase 		Chlamydomonas_reinhardtii.60_50	XP_001693343.2	1
833	09102 Energy metabolism	00920 Sulfur metabolism [PATH:ko00920]	K01738  cysK; cysteine synthase 		Chlamydomonas_reinhardtii.60_50	XP_001691935.1	1
834	09103 Lipid metabolism	00564 Glycerophospholipid metabolism [PATH:ko00564]	K00006  GP1; glycerol-3-phosphate dehydrogenase (NA+) 		Chlamydomonas_reinhardtii.60_50	XP_042919880.1	1
835	09103 Lipid metabolism	00564 Glycerophospholipid metabolism [PATH:ko00564]	K01126  E3.1.4.46, glpQ, ugpQ; glycerophosphoryl diester phosphodiesterase 		Chlamydomonas_reinhardtii.60_50	XP_042915965.1	1
836	09103 Lipid metabolism	00590 Arachidonic acid metabolism [PATH:ko00590]	K04097  HPGS; prostaglandin-H2 -isomerase / glutathione transferase 		Chlamydomonas_reinhardtii.60_50	XP_001699262.1	1
837	09103 Lipid metabolism	00592 alpha-Linolenic acid metabolism [PATH:ko00592]	K05894  OPR; 12-oxophytodienoic acid reductase 		Chlamydomonas_reinhardtii.60_50	XP_001699408.1	1
838	09104 Nucleotide metabolism	00230 Purine metabolism [PATH:ko00230]	K00940  ndk, NME; nucleoside-diphosphate kinase 		Chlamydomonas_reinhardtii.60_50	XP_001698246.1	1
839	09104 Nucleotide metabolism	00230 Purine metabolism [PATH:ko00230]	K12319  GUCY1B; guanylate cyclase soluble subunit beta 		Chlamydomonas_reinhardtii.60_50	XP_042922539.1	1
840	09104 Nucleotide metabolism	00230 Purine metabolism [PATH:ko00230]	K12324  ANPRB, NPR2; atrial natriuretic peptide receptor B 		Chlamydomonas_reinhardtii.60_50	XP_001702503.2	1
841	09104 Nucleotide metabolism	00230 Purine metabolism [PATH:ko00230]	K13755  PE1; calcium/calmodulin-dependent 3',5'-cyclic nucleotide phosphodiesterase 		Chlamydomonas_reinhardtii.60_50	XP_042921123.1, XP_042917215.1, XP_042916788.1, XP_042915682.1	4
842	09104 Nucleotide metabolism	00230 Purine metabolism [PATH:ko00230]	K13293  PE4; cAMP-specific phosphodiesterase 4 		Chlamydomonas_reinhardtii.60_50	XP_042921123.1, XP_042918881.1, XP_042915682.1	3
843	09104 Nucleotide metabolism	00240 Pyrimidine metabolism [PATH:ko00240]	K00876  udk, UCK; uridine kinase 		Chlamydomonas_reinhardtii.60_50	XP_001691897.2	1
844	09104 Nucleotide metabolism	00240 Pyrimidine metabolism [PATH:ko00240]	K00943  tmk, TYMK; dTMP kinase 		Chlamydomonas_reinhardtii.60_50	XP_001692044.2	1
845	09105 Amino acid metabolism	00250 Alanine, aspartate and glutamate metabolism [PATH:ko00250]	K13566  NIT2, yafV; omega-amidase 		Chlamydomonas_reinhardtii.60_50	XP_001690839.2	1
846	09105 Amino acid metabolism	00260 Glycine, serine and threonine metabolism [PATH:ko00260]	K00872  thrB; homoserine kinase 		Chlamydomonas_reinhardtii.60_50	XP_042926889.1	1
847	09105 Amino acid metabolism	00270 ysteine and methionine metabolism [PATH:ko00270]	K05396  dcy; -cysteine desulfhydrase 		Chlamydomonas_reinhardtii.60_50	XP_042922514.1	1
848	09105 Amino acid metabolism	00270 ysteine and methionine metabolism [PATH:ko00270]	K08968  msrC; L-methionine (R)-S-oxide reductase 		Chlamydomonas_reinhardtii.60_50	XP_042923055.1	1
849	09105 Amino acid metabolism	00330 Arginine and proline metabolism [PATH:ko00330]	K00472  P4HA; prolyl 4-hydroxylase 		Chlamydomonas_reinhardtii.60_50	XP_001701720.2, XP_042919747.1	2
850	09105 Amino acid metabolism	00350 Tyrosine metabolism [PATH:ko00350]	K00457  HP, hpp; 4-hydroxyphenylpyruvate dioxygenase 		Chlamydomonas_reinhardtii.60_50	XP_001694722.2	1
851	09106 Metabolism of other amino acids	00480 Glutathione metabolism [PATH:ko00480]	K00799  GST, gst; glutathione S-transferase 		Chlamydomonas_reinhardtii.60_50	XP_042916411.1	1
852	09106 Metabolism of other amino acids	00480 Glutathione metabolism [PATH:ko00480]	K24138  prx3; glutaredoxin/glutathione-dependent peroxiredoxin 		Chlamydomonas_reinhardtii.60_50	XP_001689455.1	1
853	09107 Glycan biosynthesis and metabolism	00514 Other types of O-glycan biosynthesis [PATH:ko00514]	K20784  XEG113; arabinosyltransferase 		Chlamydomonas_reinhardtii.60_50	XP_001692305.2	1
854	09107 Glycan biosynthesis and metabolism	00534 Glycosaminoglycan biosynthesis - heparan sulfate / heparin [PATH:ko00534]	K01793  GLCE; heparosan-N-sulfate-glucuronate 5-epimerase 		Chlamydomonas_reinhardtii.60_50	XP_042918104.1	1
855	09108 Metabolism of cofactors and vitamins	00860 Porphyrin and chlorophyll metabolism [PATH:ko00860]	K03405  chlI, bchI; magnesium chelatase subunit I 		Chlamydomonas_reinhardtii.60_50	XP_001690873.1	1
856	09108 Metabolism of cofactors and vitamins	00860 Porphyrin and chlorophyll metabolism [PATH:ko00860]	K04035  E1.14.13.81, acsF, chlE; magnesium-protoporphyrin IX monomethyl ester (oxidative) cyclase 		Chlamydomonas_reinhardtii.60_50	XP_001691047.2	1
857	09108 Metabolism of cofactors and vitamins	00860 Porphyrin and chlorophyll metabolism [PATH:ko00860]	K01764  HCCS; cytochrome c heme-lyase 		Chlamydomonas_reinhardtii.60_50	XP_042918551.1, XP_042918565.1, XP_042918560.1	3
858	09108 Metabolism of cofactors and vitamins	00130 Ubiquinone and other terpenoid-quinone biosynthesis [PATH:ko00130]	K03809  wrbA; NA(P)H dehydrogenase (quinone) 		Chlamydomonas_reinhardtii.60_50	XP_001698549.2, XP_001698551.1	2
859	09109 Metabolism of terpenoids and polyketides	00900 Terpenoid backbone biosynthesis [PATH:ko00900]	K15889  PCME; prenylcysteine alpha-carboxyl methylesterase 		Chlamydomonas_reinhardtii.60_50	XP_042927657.1	1
860	09109 Metabolism of terpenoids and polyketides	00906 arotenoid biosynthesis [PATH:ko00906]	K17913  CC8; carlactone synthase / all-trans-10'-apo-beta-carotenal 13,14-cleaving dioxygenase 		Chlamydomonas_reinhardtii.60_50	XP_001701620.1	1
861	09121 Transcription	03040 Spliceosome [PATH:ko03040]	K12818  HX8, PRP22; ATP-dependent RNA helicase HX8/PRP22 		Chlamydomonas_reinhardtii.60_50	XP_042922719.1	1
862	09121 Transcription	03040 Spliceosome [PATH:ko03040]	K03283  HSPA1s; heat shock 70ka protein 1/2/6/8		Chlamydomonas_reinhardtii.60_50	XP_001701326.1, XP_001691146.2	2
863	09121 Transcription	03040 Spliceosome [PATH:ko03040]	K12896  SFRS7; splicing factor, arginine/serine-rich 7		Chlamydomonas_reinhardtii.60_50	XP_001696769.1	1
864	09122 Translation	03010 Ribosome [PATH:ko03010]	K02978  RP-S27e, RPS27; small subunit ribosomal protein S27e		Chlamydomonas_reinhardtii.60_50	XP_001694878.1	1
865	09122 Translation	03010 Ribosome [PATH:ko03010]	K02927  RP-L40e, RPL40, UBA52; ubiquitin-large subunit ribosomal protein L40e		Chlamydomonas_reinhardtii.60_50	XP_001694608.1	1
866	09122 Translation	00970 Aminoacyl-tRNA biosynthesis [PATH:ko00970]	K01870  IARS, ileS; isoleucyl-tRNA synthetase 		Chlamydomonas_reinhardtii.60_50	XP_001698234.1	1
867	09122 Translation	03013 RNA transport [PATH:ko03013]	K03231  EEF1A; elongation factor 1-alpha		Chlamydomonas_reinhardtii.60_50	XP_001696568.1	1
868	09122 Translation	03013 RNA transport [PATH:ko03013]	K12160  SUMO, SMT3; small ubiquitin-related modifier		Chlamydomonas_reinhardtii.60_50	XP_042914618.1	1
869	09122 Translation	03015 mRNA surveillance pathway [PATH:ko03015]	K04382  PPP2C; serine/threonine-protein phosphatase 2A catalytic subunit 		Chlamydomonas_reinhardtii.60_50	XP_001691361.1	1
870	09122 Translation	03008 Ribosome biogenesis in eukaryotes [PATH:ko03008]	K03097  CSNK2A; casein kinase II subunit alpha 		Chlamydomonas_reinhardtii.60_50	XP_001701441.1	1
871	09122 Translation	03008 Ribosome biogenesis in eukaryotes [PATH:ko03008]	K11129  NHP2, NOLA2; H/ACA ribonucleoprotein complex subunit 2		Chlamydomonas_reinhardtii.60_50	XP_001699242.1	1
872	09123 Folding, sorting and degradation	03060 Protein export [PATH:ko03060]	K09490  HSPA5, BIP; endoplasmic reticulum chaperone BiP 		Chlamydomonas_reinhardtii.60_50	XP_001701326.1	1
873	09123 Folding, sorting and degradation	04141 Protein processing in endoplasmic reticulum [PATH:ko04141]	K13993  HSP20; HSP20 family protein		Chlamydomonas_reinhardtii.60_50	XP_001701015.1, XP_001689821.1	2
874	09123 Folding, sorting and degradation	04141 Protein processing in endoplasmic reticulum [PATH:ko04141]	K06689  UBE2, UBC4, UBC5; ubiquitin-conjugating enzyme E2 		Chlamydomonas_reinhardtii.60_50	XP_001699308.1	1
875	09123 Folding, sorting and degradation	04130 SNARE interactions in vesicular transport [PATH:ko04130]	K08506  SYP7; syntaxin of plants SYP7		Chlamydomonas_reinhardtii.60_50	XP_001700030.1	1
876	09123 Folding, sorting and degradation	04120 Ubiquitin mediated proteolysis [PATH:ko04120]	K20217  UBE2E; ubiquitin-conjugating enzyme E2 E 		Chlamydomonas_reinhardtii.60_50	XP_001699308.1	1
877	09123 Folding, sorting and degradation	03018 RNA degradation [PATH:ko03018]	K12598  MTR4, SKIV2L2; ATP-dependent RNA helicase OB1 		Chlamydomonas_reinhardtii.60_50	XP_042924112.1	1
878	09123 Folding, sorting and degradation	03018 RNA degradation [PATH:ko03018]	K04077  groEL, HSP1; chaperonin GroEL		Chlamydomonas_reinhardtii.60_50	XP_001692504.1	1
879	09124 Replication and repair	03030 DNA replication [PATH:ko03030]	K04799  FEN1, RA2; flap endonuclease-1 		Chlamydomonas_reinhardtii.60_50	XP_001699242.1	1
880	09131 Membrane transport	02010 AB transporters [PATH:ko02010]	K02040  pstS; phosphate transport system substrate-binding protein		Chlamydomonas_reinhardtii.60_50	XP_042928753.1	1
881	09131 Membrane transport	02010 AB transporters [PATH:ko02010]	K05643  ABCA3; ATP-binding cassette, subfamily A (ABC1), member 3		Chlamydomonas_reinhardtii.60_50	XP_042924019.1	1
882	09131 Membrane transport	02010 AB transporters [PATH:ko02010]	K05658  ABCB1, C243; ATP-binding cassette, subfamily B (MR/TAP), member 1 		Chlamydomonas_reinhardtii.60_50	XP_042914787.1	1
883	09132 Signal transduction	04014 Ras signaling pathway [PATH:ko04014]	K02183  CALM; calmodulin		Chlamydomonas_reinhardtii.60_50	XP_001703260.2	1
884	09132 Signal transduction	04015 Rap1 signaling pathway [PATH:ko04015]	K02105  CTNNB1; catenin beta 1		Chlamydomonas_reinhardtii.60_50	XP_001693849.2	1
885	09132 Signal transduction	04015 Rap1 signaling pathway [PATH:ko04015]	K23487  EVL; Ena/VASP-like protein		Chlamydomonas_reinhardtii.60_50	XP_042916474.1	1
886	09132 Signal transduction	04010 MAPK signaling pathway [PATH:ko04010]	K04373  RPS6KA; ribosomal protein S6 kinase alpha-1/2/3/6 		Chlamydomonas_reinhardtii.60_50	XP_042918552.1	1
887	09132 Signal transduction	04010 MAPK signaling pathway [PATH:ko04010]	K04419  MAP3K11, MLK3; mitogen-activated protein kinase kinase kinase 11 		Chlamydomonas_reinhardtii.60_50	XP_042921047.1	1
888	09132 Signal transduction	04013 MAPK signaling pathway - fly [PATH:ko04013]	K08892  FRK, PTK5; fyn-related kinase 		Chlamydomonas_reinhardtii.60_50	XP_001694443.2	1
889	09132 Signal transduction	04016 MAPK signaling pathway - plant [PATH:ko04016]	K14512  MPK6; mitogen-activated protein kinase 6 		Chlamydomonas_reinhardtii.60_50	XP_001700291.1	1
890	09132 Signal transduction	04016 MAPK signaling pathway - plant [PATH:ko04016]	K20535  MPK1_2; mitogen-activated protein kinase 1/2 		Chlamydomonas_reinhardtii.60_50	XP_001700291.1	1
891	09132 Signal transduction	04016 MAPK signaling pathway - plant [PATH:ko04016]	K14498  SNRK2; serine/threonine-protein kinase SRK2 		Chlamydomonas_reinhardtii.60_50	XP_001701605.1	1
892	09132 Signal transduction	04011 MAPK signaling pathway - yeast [PATH:ko04011]	K06630  YWHAE; 14-3-3 protein epsilon		Chlamydomonas_reinhardtii.60_50	XP_001696613.1	1
893	09132 Signal transduction	04310 Wnt signaling pathway [PATH:ko04310]	K17334  NFATC4, NFAT3; nuclear factor of activated T-cells, cytoplasmic 4		Chlamydomonas_reinhardtii.60_50	XP_001692736.2	1
894	09132 Signal transduction	04340 Hedgehog signaling pathway [PATH:ko04340]	K10523  SPOP; speckle-type POZ protein		Chlamydomonas_reinhardtii.60_50	XP_001689973.1	1
895	09132 Signal transduction	04390 Hippo signaling pathway [PATH:ko04390]	K24050  LG5; discs large protein 5		Chlamydomonas_reinhardtii.60_50	XP_042914744.1	1
896	09132 Signal transduction	04371 Apelin signaling pathway [PATH:ko04371]	K18050  PRKCE; novel protein kinase C epsilon type 		Chlamydomonas_reinhardtii.60_50	XP_042926332.1	1
897	09132 Signal transduction	04020 alcium signaling pathway [PATH:ko04020]	K15040  VAC2; voltage-dependent anion channel protein 2		Chlamydomonas_reinhardtii.60_50	XP_001689450.1	1
898	09132 Signal transduction	04072 Phospholipase D signaling pathway [PATH:ko04072]	K07937  ARF1_2; AP-ribosylation factor 1/2		Chlamydomonas_reinhardtii.60_50	XP_001690893.1	1
899	09141 Transport and catabolism	04144 Endocytosis [PATH:ko04144]	K19475  WIPF; WAS/WASL-interacting protein		Chlamydomonas_reinhardtii.60_50	XP_042920505.1	1
900	09141 Transport and catabolism	04145 Phagosome [PATH:ko04145]	K07374  TUBA; tubulin alpha		Chlamydomonas_reinhardtii.60_50	XP_001691876.1	1
901	09141 Transport and catabolism	04145 Phagosome [PATH:ko04145]	K07375  TUBB; tubulin beta		Chlamydomonas_reinhardtii.60_50	XP_001693997.1	1
902	09141 Transport and catabolism	04142 Lysosome [PATH:ko04142]	K19363  LITAF; lipopolysaccharide-induced tumor necrosis factor-alpha factor		Chlamydomonas_reinhardtii.60_50	XP_042922610.1	1
903	09141 Transport and catabolism	04146 Peroxisome [PATH:ko04146]	K13348  MPV17; protein Mpv17		Chlamydomonas_reinhardtii.60_50	XP_001694102.2	1
904	09143 Cell growth and death	04214 Apoptosis - fly [PATH:ko04214]	K03386  PRX2_4, ahpC; peroxiredoxin 2/4 		Chlamydomonas_reinhardtii.60_50	XP_001696611.1	1
905	09143 Cell growth and death	04217 Necroptosis [PATH:ko04217]	K11251  H2A; histone H2A		Chlamydomonas_reinhardtii.60_50	XP_001690672.1	1
906	09151 Immune system	04621 NOD-like receptor signaling pathway [PATH:ko04621]	K14216  OAS; 2'-5'-oligoadenylate synthetase 		Chlamydomonas_reinhardtii.60_50	XP_042917848.1	1
907	09152 Endocrine system	04922 Glucagon signaling pathway [PATH:ko04922]	K15423  PPP4C; serine/threonine-protein phosphatase 4 catalytic subunit 		Chlamydomonas_reinhardtii.60_50	XP_001691361.1	1
908	09154 Digestive system	04970 Salivary secretion [PATH:ko04970]	K13912  MBT1; deleted in malignant brain tumors 1 protein		Chlamydomonas_reinhardtii.60_50	XP_042922320.1	1
909	09154 Digestive system	04974 Protein digestion and absorption [PATH:ko04974]	K14207  SLC38A2, SNAT2; solute carrier family 38 (sodium-coupled neutral amino acid transporter), member 2		Chlamydomonas_reinhardtii.60_50	XP_001694884.1	1
910	09158 Development and regeneration	04361 Axon regeneration [PATH:ko04361]	K11593  ELF2C, AGO; eukaryotic translation initiation factor 2C		Chlamydomonas_reinhardtii.60_50	XP_042916315.1	1
911	09149 Aging	04213 Longevity regulating pathway - multiple species [PATH:ko04213]	K03695  clpB; ATP-dependent Clp protease ATP-binding subunit ClpB		Chlamydomonas_reinhardtii.60_50	XP_042919326.1	1
912	09159 Environmental adaptation	04714 Thermogenesis [PATH:ko04714]	K15109  SLC25A20_29, CACT, CACL, CRC1; solute carrier family 25 (mitochondrial carnitine/acylcarnitine transporter), member 20/29		Chlamydomonas_reinhardtii.60_50	XP_001692197.1	1
913	09159 Environmental adaptation	04626 Plant-pathogen interaction [PATH:ko04626]	K13412  CPK; calcium-dependent protein kinase 		Chlamydomonas_reinhardtii.60_50	XP_042919823.1	1
914	09161 Cancer: overview	05202 Transcriptional misregulation in cancer [PATH:ko05202]	K11253  H3; histone H3		Chlamydomonas_reinhardtii.60_50	XP_042927417.1	1
915	09161 Cancer: overview	05203 Viral carcinogenesis [PATH:ko05203]	K11252  H2B; histone H2B		Chlamydomonas_reinhardtii.60_50	XP_001690668.1	1
916	09161 Cancer: overview	05203 Viral carcinogenesis [PATH:ko05203]	K11254  H4; histone H4		Chlamydomonas_reinhardtii.60_50	XP_001690721.1	1
917	09163 Immune disease	05322 Systemic lupus erythematosus [PATH:ko05322]	K11089  TROVE2, SSA2; 60 ka SS-A/Ro ribonucleoprotein		Chlamydomonas_reinhardtii.60_50	XP_042914800.1	1
918	09164 Neurodegenerative disease	05016 Huntington disease [PATH:ko05016]	K04418  MAP3K10, MLK2; mitogen-activated protein kinase kinase kinase 10 		Chlamydomonas_reinhardtii.60_50	XP_042921047.1	1
919	09171 Infectious disease: bacterial	05132 Salmonella infection [PATH:ko05132]	K10419  YNLRB, NCL2; dynein light chain roadblock-type		Chlamydomonas_reinhardtii.60_50	XP_001694381.1	1
920	09181 Protein families: metabolism	01009 Protein phosphatases and associated proteins [BR:ko01009]	K17586  PHRF1; PH and RING finger domain-containing protein 1		Chlamydomonas_reinhardtii.60_50	XP_042918962.1	1
921	09181 Protein families: metabolism	01009 Protein phosphatases and associated proteins [BR:ko01009]	K17609  NXN; nucleoredoxin 		Chlamydomonas_reinhardtii.60_50	XP_001701806.1	1
922	09181 Protein families: metabolism	01009 Protein phosphatases and associated proteins [BR:ko01009]	K15498  PPP6C; serine/threonine-protein phosphatase 6 catalytic subunit 		Chlamydomonas_reinhardtii.60_50	XP_001691361.1	1
923	09181 Protein families: metabolism	01009 Protein phosphatases and associated proteins [BR:ko01009]	K15504  ANKR52; serine/threonine-protein phosphatase 6 regulatory ankyrin repeat subunit C		Chlamydomonas_reinhardtii.60_50	XP_042920752.1	1
924	09181 Protein families: metabolism	01009 Protein phosphatases and associated proteins [BR:ko01009]	K14165  K14165; atypical dual specificity phosphatase 		Chlamydomonas_reinhardtii.60_50	XP_001694599.1	1
925	09181 Protein families: metabolism	01002 Peptidases and inhibitors [BR:ko01002]	K09602  OTUB1; ubiquitin thioesterase protein OTUB1 		Chlamydomonas_reinhardtii.60_50	XP_042923344.1	1
926	09181 Protein families: metabolism	01003 Glycosyltransferases [BR:ko01003]	K08251  A4GNT; alpha 1,4-N-acetylglucosaminyltransferase 		Chlamydomonas_reinhardtii.60_50	XP_001697922.1	1
927	09181 Protein families: metabolism	01003 Glycosyltransferases [BR:ko01003]	K11000  CALS; callose synthase 		Chlamydomonas_reinhardtii.60_50	XP_042924331.1	1
928	09182 Protein families: genetic information processing	03000 Transcription factors [BR:ko03000]	K09387  FOXA1, HNF3A; forkhead box protein A1, hepatocyte nuclear factor 3-alpha		Chlamydomonas_reinhardtii.60_50	XP_042914114.1	1
929	09182 Protein families: genetic information processing	03000 Transcription factors [BR:ko03000]	K09422  MYBP; transcription factor MYB, plant		Chlamydomonas_reinhardtii.60_50	XP_001699208.2	1
930	09182 Protein families: genetic information processing	03000 Transcription factors [BR:ko03000]	K09286  EREBP; EREBP-like factor		Chlamydomonas_reinhardtii.60_50	XP_042921884.1	1
931	09182 Protein families: genetic information processing	03009 Ribosome biogenesis [BR:ko03009]	K11135  PINX1; Pin2-interacting protein X1		Chlamydomonas_reinhardtii.60_50	XP_042923055.1	1
932	09182 Protein families: genetic information processing	03009 Ribosome biogenesis [BR:ko03009]	K14810  X56, BP9; ATP-dependent RNA helicase X56/BP9 		Chlamydomonas_reinhardtii.60_50	XP_042918562.1	1
933	09182 Protein families: genetic information processing	03016 Transfer RNA biogenesis [BR:ko03016]	K07560  dtd, T; -aminoacyl-tRNA deacylase 		Chlamydomonas_reinhardtii.60_50	XP_042919184.1	1
934	09182 Protein families: genetic information processing	03016 Transfer RNA biogenesis [BR:ko03016]	K05542  US1; tRNA-dihydrouridine synthase 1 		Chlamydomonas_reinhardtii.60_50	XP_042921866.1	1
935	09182 Protein families: genetic information processing	03012 Translation factors [BR:ko03012]	K22857  EEF1AKMT4; EEF1A lysine methyltransferase 4 		Chlamydomonas_reinhardtii.60_50	XP_042925030.1	1
936	09182 Protein families: genetic information processing	03110 haperones and folding catalysts [BR:ko03110]	K04082  hscB, HSCB, HSC20; molecular chaperone HscB		Chlamydomonas_reinhardtii.60_50	XP_042918185.1	1
937	09182 Protein families: genetic information processing	03110 haperones and folding catalysts [BR:ko03110]	K03768  PPIB, ppiB; peptidyl-prolyl cis-trans isomerase B (cyclophilin B) 		Chlamydomonas_reinhardtii.60_50	XP_042919139.1, XP_001693941.2	2
938	09182 Protein families: genetic information processing	03110 haperones and folding catalysts [BR:ko03110]	K03676  grxC, GLRX, GLRX2; glutaredoxin 3		Chlamydomonas_reinhardtii.60_50	XP_001694001.1	1
939	09182 Protein families: genetic information processing	04131 Membrane trafficking [BR:ko04131]	K08511  ATVAMP72; vesicle-associated membrane protein 72		Chlamydomonas_reinhardtii.60_50	XP_001692216.1	1
940	09182 Protein families: genetic information processing	04131 Membrane trafficking [BR:ko04131]	K21440  ANKR50; ankyrin repeat domain-containing protein 50		Chlamydomonas_reinhardtii.60_50	XP_042920519.1	1
941	09182 Protein families: genetic information processing	04131 Membrane trafficking [BR:ko04131]	K07942  ARL1; AP-ribosylation factor-like protein 1		Chlamydomonas_reinhardtii.60_50	XP_001690893.1	1
942	09182 Protein families: genetic information processing	04131 Membrane trafficking [BR:ko04131]	K01551  arsA, ASNA1, GET3; arsenite/tail-anchored protein-transporting ATPase 		Chlamydomonas_reinhardtii.60_50	XP_042914113.1	1
943	09182 Protein families: genetic information processing	04131 Membrane trafficking [BR:ko04131]	K07910  RAB18; Ras-related protein Rab-18		Chlamydomonas_reinhardtii.60_50	XP_001697342.1	1
944	09182 Protein families: genetic information processing	04121 Ubiquitin system [BR:ko04121]	K12158  NE8; ubiquitin-like protein Nedd8		Chlamydomonas_reinhardtii.60_50	XP_001694608.1	1
945	09182 Protein families: genetic information processing	04121 Ubiquitin system [BR:ko04121]	K10645  MIB; E3 ubiquitin-protein ligase mind-bomb 		Chlamydomonas_reinhardtii.60_50	XP_042914454.1	1
946	09182 Protein families: genetic information processing	04121 Ubiquitin system [BR:ko04121]	K17822  CUN11_2; CN1-like protein 1/2		Chlamydomonas_reinhardtii.60_50	XP_001689460.2	1
947	09182 Protein families: genetic information processing	04121 Ubiquitin system [BR:ko04121]	K10466  KLHL30; kelch-like protein 30		Chlamydomonas_reinhardtii.60_50	XP_001698726.2	1
948	09182 Protein families: genetic information processing	04121 Ubiquitin system [BR:ko04121]	K10474  KBTB6_7; kelch repeat and BTB domain-containing protein 6/7		Chlamydomonas_reinhardtii.60_50	XP_042914366.1	1
949	09182 Protein families: genetic information processing	04121 Ubiquitin system [BR:ko04121]	K10479  BTB7; BTB/POZ domain-containing protein 7		Chlamydomonas_reinhardtii.60_50	XP_001698726.2	1
950	09182 Protein families: genetic information processing	03036 hromosome and associated proteins [BR:ko03036]	K11275  H1_5; histone H1/5		Chlamydomonas_reinhardtii.60_50	XP_001693443.1	1
951	09182 Protein families: genetic information processing	03036 hromosome and associated proteins [BR:ko03036]	K11657  RSF1; remodeling and spacing factor 1		Chlamydomonas_reinhardtii.60_50	XP_042916043.1	1
952	09182 Protein families: genetic information processing	03036 hromosome and associated proteins [BR:ko03036]	K23408  CCA7, JPO1; cell division cycle-associated protein 7		Chlamydomonas_reinhardtii.60_50	XP_042921077.1	1
953	09182 Protein families: genetic information processing	03400 DNA repair and recombination proteins [BR:ko03400]	K19596  PLK5; inactive serine/threonine-protein kinase PLK5		Chlamydomonas_reinhardtii.60_50	XP_042925027.1	1
954	09182 Protein families: genetic information processing	03400 DNA repair and recombination proteins [BR:ko03400]	K03574  mutT, NUT15, MTH2; 8-oxo-dGTP diphosphatase 		Chlamydomonas_reinhardtii.60_50	XP_001691864.2	1
955	09183 Protein families: signaling and cellular processes	02000 Transporters [BR:ko02000]	K14724  SLC9A8, NHE8; solute carrier family 9 (sodium/hydrogen exchanger), member 8		Chlamydomonas_reinhardtii.60_50	XP_001700217.2	1
956	09183 Protein families: signaling and cellular processes	02000 Transporters [BR:ko02000]	K14347  SLC10A7, P7; solute carrier family 10 (sodium/bile acid cotransporter), member 7		Chlamydomonas_reinhardtii.60_50	XP_042927186.1	1
957	09183 Protein families: signaling and cellular processes	02000 Transporters [BR:ko02000]	K14640  SLC20A, PIT; solute carrier family 20 (sodium-dependent phosphate transporter)		Chlamydomonas_reinhardtii.60_50	XP_042916211.1, XP_001702863.1, XP_001694872.1	3
958	09183 Protein families: signaling and cellular processes	02000 Transporters [BR:ko02000]	K14709  SLC39A1_2_3, ZIP1_2_3; solute carrier family 39 (zinc transporter), member 1/2/3		Chlamydomonas_reinhardtii.60_50	XP_042917393.1	1
959	09183 Protein families: signaling and cellular processes	02000 Transporters [BR:ko02000]	K03320  amt, AMT, MEP; ammonium transporter, Amt family		Chlamydomonas_reinhardtii.60_50	XP_001692671.2	1
960	09183 Protein families: signaling and cellular processes	02000 Transporters [BR:ko02000]	K21989  TMEM63; calcium permeable stress-gated cation channel		Chlamydomonas_reinhardtii.60_50	XP_042921806.1	1
